사이트,제목,링크,내용
한경,"트럼프 관세 예고, 외환시장 긴장감 증폭 [원자재 &ETF뉴스]",https://www.hankyung.com/article/2024112896195,"(방송 원문입니다.)원자재 시황도 살펴보겠습니다. 현재 시간 5시 44분 지나가고 있고요, 5시 수치를 기준으로 하고 있습니다. 국제유가부터 확인해 보겠습니다. 원유 시장은 중동 지역의 휴전 합의와 이번주에 다음달 1일로 예정된 OPEC+의 정례회의에서 내년 1월로 미뤄졌던 하루 18만 배럴의 증산을 재차 연기하는 방안을 검토 중이라는 보도를 동시에 주목하고 있습니다. 유가는 오늘 보합권 근처에서 미미하게 움직이고 있습니다. WTI는 68달러 후반대, 브렌트유는 72달러 후반대에서 거래되고 있고요, 미국 천연가스 선물은 다음주, 미국 전역에 한파가 예고됐음에도 불구하고 재고 과잉 집계로 인해 7%대 급락하고 있습니다. 1년래 최고치였던 이번주 화요일 기준 고점에 비해서도 7.6%나 낮아진 것으로 보고됐고요, 올해 최저점을 기록했습니다. 트럼프의 대규모 관세 공언에, 주요 곡물 선물들도 수출 제한에 직면할 수 있습니다. 대두 선물은 강보합권으로 상승폭 줄여나가고 있고요, 밀 선물도 이와 함께 남미 일대의 공급 호조까지 더해지며 1.7% 더 크게 낙폭 키워가고 있습니다. 브라질 중남부의 생산 감소에 설탕 선물이 오늘 0.3% 내외로 오르고 있고요, 서아프리카의 작황 부진으로 그간 상승분을 반납하고 코코아 선물은 이날은 1%대 빠지고 있습니다. 지정학적 리스크가 줄어들며 금의 매수세도 이전에 비하면 크게 둔화됐고요, 또 오늘은 장중 내내 미국의 10월 개인소비지출 PCE 발표를 대기하며 금 선물은 좁은 범위에서 미미한 등락 보였습니다. 0.5% 상승하며 온스당 2,630달러 선 지나가고 있고요, 은 선물은 1% 더 크게 내려가고 있습니다. 주요 금속 선물들도 휴장을 앞두고 관망세 보이고 있습니다. 팔라듐 선물이 1%, 니켈 선물이 0.5% 밀려나고 있고요, 반면 백금 선물은 0.3%, 구리 선물은 0.8% 내외로 상방압력 받고 있습니다.암호화폐 시황도 살펴보겠습니다. 트럼프 당선인이 암호화폐 규제를 주도할 기관으로 상품선물거래위원회 CFTC를 염두에 두고 있다고 폭스비즈니스가 전했습니다. 미국 증권거래위원회 SEC의 권한을 약화시키려는 의도로 풀이되는데요, 요 며칠 조정 구간에 진입했던 비트코인은 해당 소식 이후 다시 한번 상승 탄력을 받고 있습니다. 현재 비트코인, 5%대 오르면서 96,500달러 선 터치하고 있습니다.주요 ETF 동향도 살펴보겠습니다. 3대지수 ETF 하락 중이고요, 섹터별로는 XLV 헬스케어 ETF가 0.5%로 상승폭이 가장 크고, 반대로는 SOXX 반도체 ETF가 1.6%로 낙폭이 가장 깊은 상황입니다.오늘은 ‘외환 시장’을 주제로 한 ETF 2가지 살펴보겠습니다. 캐나다달러화, 그리고 위안화 관련된 소식들 차례대로 체크해 보겠습니다. 먼저, ‘아이셰어즈 MSCI 캐나다 ETF’, 티커명 EWC입니다. 아이셰어즈에서 운용하고 있고요, 캐나다 주식으로 구성된 ‘MSCI 캐나다 커스텀 캡드 지수’를 추종하고요, 캐나다 증시의 96%를 커버하는 ETF입니다. 캐나다달러화를 직접적으로 따르는 상품은 아직 미국 ETF 시장에는 없습니다. 미장 내 캐나다 관련 ETF는 이렇게 3가지인데요, 가장 대중적으로 거래되는 건 이 EWC ETF고요, 그 외에는 ‘JP모간 베타빌더스 캐나다 ETF’, 티커명 BBCA, 또 ‘프랭클린 FTSE 캐나다 ETF’, 티커명 FLCA도 있습니다. EWC ETF는 금융과 에너지, 산업재, IT 등의 기업들을 두루두루 아우르고 있고요, 대형주와 중형주의 비율은 87%와 13%, 성장주와 가치주의 비중은 26%와 39% 정도 나타내고 있습니다. 개별 기업들의 비중은 22.5%로 제한됩니다. BBCA ETF는 대형주와 중형주의 비중이 88%와 12%로, EWC ETF보다 대형주의 존재감이 더 강하고요, 캐나다 상장 기업들의 시가총액 약 85%를 포함합니다. FLCA ETF는 대형주와 중형주가 각각 97%와 3%로, 세 ETF 중 대형주의 비중이 가장 높습니다. 캐나다의 중대형주들로 이루어져있다는 공통점 때문에, 세 ETF는 거의 동일한 흐름을 보여 왔고요, 등락이 있다면 개별 종목들의 이슈에 의해 변동될 가능성이 높습니다.트럼프 당선인이 마약 유입 및 불법 이민 문제에 대응하기 위해, 취임 첫날인 1월 20일에 중국과 캐나다, 그리고 멕시코에 대한 추가 관세 부과를 공언했죠? 이에 따라 전세계 외환시장이 긴장하고 있습니다. 발표 직후, 제일 먼저 멕시코의 페소화가 달러화 대비 2% 넘게 하락했고요, 이후 캐나다달러화가 4년 반 만에 최저치, 그리고 중국의 위안화도 4개월래 최저치까지 떨어졌습니다. 골드만삭스는, 트럼프의 이번 관세 공약은 자유무역협정, FTA를 위반할 수 있는 조치라며, 이에 대한 시장의 첫번째 대비로는, 외환 변동성의 급등에 대한 대응책이 마련돼야 할 것이라고 조언했습니다. CNBC 역시, 트럼프의 당선이 확정된 순간, 외환 시장의 불안은 예견됐던 것이라며, 환율이 관세 발표에 제일 먼저 반응하는 수단이라는 점을 감안해야 한다고 했습니다. 네덜란드 은행 ING는 트럼프의 관세 위협을 1월 취임 전의 협상 전술의 일환에 불과할 것이라, 우려가 과도할 필요는 없지만, 외환 시장의 동향을 과소평가해서는 안 된다고 지적했고요, 씨티그룹도 차기 트럼프 행정부가 관세를 협상 도구로 사용할 것으로 예상되기 때문에, 실질적인 파장이 생각보다 크지는 않을 것이라면서도 단기간 내 외환시장의 움직임은 주의해야 한다고 했습니다. 씨티그룹은, 헤드라인 하나에 멕시코의 페소화가 하룻밤 사이에도 2%까지 내려갈 수 있다며, 트럼프가 관세를 캐나다와 멕시코, 그리고 중국 정부와 협상하는 데 중요한 지렛대로 활용할 것임은 분명하다고 했고요, 관세 부과보다는 추후 협상 내용이 더 중요할 것이라고 했습니다.다음은 ‘위즈덤트리 중국 위안화 스트래티지 펀드’, 티커명 CYB입니다. 위즈덤트리에서 운용하고 있고요, 달러화 대비 위안화의 가치를 따르는 ETF입니다. 캐나다달러와 페소화도 마찬가지지만, 더 큰 문제는 사실 글로벌 시장에서의 가치가 더 큰, 중국의 위안화입니다. 위안화 역시 4개월래 최저치까지 곤두박질쳤는데요, 인민은행은 개장 전, 위안화 기준 환율을 달러당 7.1910위안으로 고시하며 환율 방어에 나섰지만, 노무라 증권 등 주요 IB들은 제한적인 효과만을 가질 것이라고 평가했습니다. 트럼프의 ‘약속 이행’ 발언 등을 고려할 때, 시장은 2차 무역 전쟁 가능성을 가격에 반영하기 시작할 것이라며, 향후 실제 관세 부과가 시행되고, 협상에 돌입하면 이는 위안화 환율에 더 큰 영향을 미칠 것이라고 보고 있습니다.실제로 트럼프 1기 당시인 2018년, 미국이 중국산 제품에 관세를 부과했을 때, 위안화의 가치는 달러화 대비 5% 넘게 하락했습니다. 이후 무역 갈등이 고조되며 1년 뒤, 추가로 1.5% 더 하락하는 등, 위안화 가치는 미중 무역 갈등에 유난히 민감하게 반응해 왔는데요, 미국은 단일 국가 기준으로 중국의 최대 교역 파트너이기 때문입니다. 번외로, 미장에 상장된 주요 외환 ETF들도 짚어볼까요? 위안화, 파운드화, 그리고 유로화 ETF가 당연히 규모가 가장 크겠죠. 달러 대비 파운드화를 담는 건, 티커명 FXB인 ‘인베스코 커런시셰어즈 브리티시 파운드 스털링 트러스트’가 있고요, 달러 대비 유로화를 추적하는 건, 티커명 FXE인 ‘인베스코 커런시셰어즈 유로 커런시 트러스트’가 있습니다. 트럼프 취임이 가까워져 오는 만큼, 달러화 강세와 관련해서 캐나다달러화, 페소화, 그리고 위안화와 함께 파운드화나 유로화의 흐름도 모니터링해 보시면 좋겠습니다.최보화 외신캐스터최보화외신캐스터 from.treasure@wowtv.co.kr"
한경,"테슬라, 탄소배출권 거래 최대 수혜자 [원자재 &ETF뉴스]",https://www.hankyung.com/article/2024112767575,"(방송 원문입니다.)원자재 시황도 살펴보겠습니다. 현재 시간 5시 44분 지나가고 있고요, 5시 수치를 기준으로 하고 있습니다. 국제유가부터 확인해 보겠습니다. 중동 지역의 휴전 합의가 임박했다는 보도가 나오자 어제 3% 넘게 하락했던 유가는 오늘은 낙폭을 줄이며 약보합권에서 거래되고 있습니다. 원유 시장은 이제 내년 1월에 예정돼 있는 OPEC+의 증산이 추가로 연기될 지의 여부에 주목하고 있습니다. WTI는 68달러 중반대, 브렌트유는 72달러 후반대 지나가고 있습니다. 미국 천연가스 선물도 어제의 급등 이후 차익실현 매물이 출회되며 1%대 빠지고 있습니다. 대두 선물은 0.2% 하락, 밀 선물은 0.2% 상승하며 큰 등락이 없는 가운데, 씨티은행이 브라질 중남부의 공급차질을 이유로, 내년과 내후년에 대한 전세계 설탕 생산량을 하향 조정하며 설탕 선물이 2%대 뛰고 있고요, 서아프리카 일대의 생산난으로 코코아 선물도 역시나 2%대 오르고 있습니다. 지정학적 리스크 축소에, 안전자산인 금의 매수세가 둔화되고 있습니다. 금 선물 오늘 0.4% 정도 상방압력 받고 있고요, 오히려 은은 1%대로 상승폭이 더 큽니다. 106선 후반으로, 여전히 고점 유지하고 있는 달러인덱스에 주요 금속 선물들이 이날도 혼조세 보입니다. 팔라듐 선물만 0.8% 오름세 연출 중이고요, 반면 백금과 구리, 니켈 선물은 1% 내외로 하방압력 받고 있습니다.암호화폐 시황도 살펴보겠습니다. 비트코인은 100,000달러 고지를 앞두고 92,000달러 지지선도 붕괴됐습니다.주요 ETF 동향도 살펴보겠습니다. 3대 지수 ETF 모두 상승 중이고요, 섹터별로는 XLP 필수소비재 ETF가 0.35%, XLV 헬스케어 ETF가 0.44% 정도로 상승폭이 가장 크고요, 반대로는 SOXX 반도체 ETF가 1.8%로 낙폭이 가장 큽니다.오늘은 ‘탄소 배출권’을 주제로 한 ETF 2가지 살펴보겠습니다. 탄소배출권이란 할당량과 크레딧을 포괄하는 개념으로, 할당량은 국가 또는 지역 내에서 정한 온실가스 배출 총량만큼 발전이나 생산 설비 등 주요 온실가스 배출원에 지급된 온실가스 배출 권리를 뜻하고요, 크레딧은 외부 온실가스 저감 프로젝트에 대해 기준 전망치 대비 온실가스 배출량을 줄였다는 증서로서, 해당 프로젝트에 지급되는 배출권을 가리킵니다. 즉, 탄소배출권 거래제란, 국제적인 기후변화 대응 체제의 기틀을 마련한 교토의정서에서 규정한 상업 거래의 개념으로, 온실가스 배출 권리인 탄소배출권을 시장에서 매매하는 시스템을 의미하죠. 쉽게 말해, 온실가스를 배출할 권리를 사고파는 건데요, 최근 환경오염 방지를 위한 규제에 따라 시장의 수급이 변화하며 해당 시장의 규모가 증대되고 있습니다. 환경 규제가 강화되면 국가와 기업들은 이 탄소배출권을 구매해야 하고요, 이에 따라 탄소배출권의 가격이 상승하고 친환경 산업 등을 영위하는 기업들의 이익도 커진다는 걸 기본 원리로 하고 있습니다.첫번째 ETF는 ‘아이셰어즈 글로벌 카본 ETF’, 티커명 KRBN입니다. 아이셰어즈에서 운용하고 있고요, 탄소배출권 시장에서 거래되는 선물 계약에 투자하는 ETF입니다. 미장 내 탄소배출권과 관련된 ETF는 크게 4가지로 나뉩니다. 탄소배출권이라는 추종 자산 자체는 동일하지만 보통 국가별로 구분을 하는데요, 이 KRBN ETF는 이 4개 탄소배출권 ETF 중 시가총액도 가장 큽니다. 미국 탄소배출권 ETF라 하면 보통 이 KRBN ETF가 제일 대중적으로 유명하죠. 유럽과 미국 시장의 탄소배출권을 주로 취급하는데요, 유럽이 75%로 더 많고 미국은 25% 남짓입니다. 유럽 탄소배출권은 전세계 시장의 90%를 차지합니다. 고로 당연히 미국보다는 유럽 탄소배출권 ETF가 더 유망하겠죠. ‘크레인셰어즈 캘리포니아 카본 allowance ETF’, 티커명 KCCC는 반면 미국 캘리포니아 지역에 한정됩니다. 잠시 후에 두번째 ETF로 살펴볼, 티커명 GRN인 ‘아이패스 시리즈 B 카본 ETN’, 그리고 티커명 KEUA인 ‘크레인셰어즈 유러피안 카본 allowance ETF’는 유럽 시장에 국한된 탄소배출권을 다루는 펀드입니다.로이터 통신은 이날, 지난해 미국의 탄소배출권 거래 현황 조사 결과, 테슬라가 압도적으로 많은 매출을 올렸다고 전했습니다. 외신을 직역하면 ‘거의 싹쓸이 수준’이라고 표현했는데요, 테슬라는 세계 최대 전기차 제조업체죠? 많은 이들이 테슬라를 전기차 기업으로만 알고 있지만, 부차적으로 ‘탄소배출권’으로도 이윤을 추구하는 곳이라는 점은 잘 알려지지 않았습니다. 테슬라 뿐 아니라 자동차 제조사들 모두, 탄소배출권의 기준에 따라, 온실가스 배출을 감축한 만큼 탄소배출권을 획득할 수 있습니다. 다만, 타기업들의 탄소배출권 실적은 그다지 좋지 않은 반면, 테슬라는 작년 한해 약 3,400만 메트릭톤으로, 거의 압도적 1위를 차지했습니다. 환산하면 17억 9,000만 달러, 한화로는 무려 2조 5,000억원에 달합니다. 제너럴모터스, 그러니까 GM도 탄소배출권 권리를 가지고 있겠죠? 하지만 GM의 경우, 약 4,400만 크레딧의 탄소배출권을 매입해, 23억 2,000만 달러, 우리돈으로는 3조 2,400억원의 적자를 본 것으로 추산됐습니다. GM 뿐 아니라 테슬라를 제외한 모든 미국의 자동차 회사들은 탄소배출권을 판 것보다 구매한 양이 더 많아, 오히려 막대한 손실을 입은 것으로 보고됐습니다.다음은 ‘아이패스 시리즈 B 카본 ETN’, 티커명 GRN입니다. 미국 시장에서 유럽 탄소배출권 펀드로, 가장 잘 알려진 대표적인 상품입니다. 트레이딩이코노믹스에 따르면, 유럽 탄소배출권 가격은 지난해 2월, 톤당 100유로도 돌파했지만 올해 2월, 52유로까지 떨어졌고요, 이후 반등하며 80유로까지 재상승했지만 지금은 다시 56유로 수준으로 내려왔습니다. ‘녹색 전환’에 대한 긍정적인 전망과 함께 한동안 유럽의 강력한 탄소중립 정책과 러우 전쟁으로 인해 유럽 천연가스 가격이 급등하며 이에 부담을 느낀 대중들이 탄소발생을 유발하는 석탄 발전으로 선회한 게 유럽 탄소배출권 시장 확대의 주원인이었는데요, 이후 유럽에 이상고온 현상이 발생해 천연가스 가격이 낮아졌고, 유럽연합 EU가 재생에너지 비중을 늘리는 ‘리파워 EU 정책’을 발표하며 탄소배출권 공급도 증가했고, 분위기는 반전됐습니다. 또, 탄소배출권의 주배출처였던 빅테크가 잇따른 원전 투자를 단행하며, 탄소배출권 구매를 중단한 것도 하나의 원인이었죠.하지만 이 같은 겹악재에도, 전문가들은 중장기적으로는 탄소배출권 가격이 상승세를 보일 것으로 보고 있습니다. 배출권거래제 대상 산업, 배출권 선판매에 따른 공급 축소, 또 유럽에 이어 영국과 미국 역시 탄소국경을 강화할 것이라며, 글로벌 배출권 가격은 결국 동조화 가능성이 크다고 진단하고 있습니다. 오늘 소개한 ETF들은 탄소배출권의 가격이 상승할 때 이익을 보는 구조인데요, 아이러니하게도, 투자자 입장에서는 수익을 위해 탄소배출권 가격이 올라야 좋은 일이지만, 이는 곧 기업들의 탄소배출이 심해지고 환경오염이 악화될 때를 의미합니다. 탄소중립이라는 주제는 이처럼 인류에게 상당히 중요한 이슈입니다. 매우 복잡한 정치, 경제, 사회, 환경 등의 문제의 복합체인 만큼, 우리 모두 다각도에서 고민해 볼 필요가 있겠습니다.최보화 외신캐스터최보화외신캐스터 from.treasure@wowtv.co.kr"
한경,트럼프 당선에 인플레 우려…주춤하는금값,https://www.hankyung.com/article/2024112661401,"지난달 2800달러 선까지 치솟은 금 가격이 최근 들어 하락세다. 도널드 트럼프 미국 대통령 당선인의 정책이 물가 상승을 유발할 것이란 우려가 금값 상승세에 찬물을 끼얹었다는 분석이 나온다.25일(현지시간) 뉴욕상품거래소에서 금선물 12월물은 트로이온스당 2618.50달러에 마감했다. 이달 들어 4.78% 하락했다. 올해 상승세를 지속하며 연일 사상 최고가를 경신하던 모습과 대조적이다.금 상장지수펀드(ETF) 가격도 동반 하락했다. ‘TIGER 금은선물(H)’과 ‘KODEX 골드선물(H)’은 같은 기간 각각 5.14%, 4.52% 떨어졌다.트럼프 당선인은 대선 기간 관세 인상과 대규모 감세 정책을 공약했다. 이 같은 정책이 시행돼 물가가 다시 급등하면 미국 중앙은행(Fed)이 기준금리 인하 속도를 늦출 수 있다. 금리와 금값은 반대로 움직이는 게 일반적이다. 금리 상승기에는 투자금이 이자를 많이 받을 수 있는 금융 상품으로 이동한다. 금리 하락기에는 금융 상품의 이자율이 떨어지기 때문에 금 수요가 상대적으로 늘어난다. 미국 기준금리 인하 시기가 예상보다 늦어질 것이란 우려가 나오자 금값이 내린 이유다.달러 강세도 금값 하락을 부추겼다. 달러와 금은 안전자산으로 분류된다. 금보다 달러에 투자하는 게 낫다고 판단하는 투자자가 많으면 금 수요가 줄어 가격이 하락할 수 있다. 비트코인 등 암호화폐 가격이 뛴 것도 금의 매력을 떨어뜨렸다.증권가에서는 Fed의 금리 인하 방향성이 바뀌지 않은 만큼 내년까지 금 가격이 상승할 것이란 분석도 나온다. 김선화 삼성자산운용 ETF운용2팀장은 “중앙은행과 투자자의 금 매수세는 당분간 지속될 것”이라고 말했다. 전규연 하나증권 연구원은 “금 가격 고평가 우려로 신흥국 중앙은행의 금 매입 속도가 줄어들고 있는 점은 변수”라고 했다.양현주 기자 hjyang@hankyung.com"
